{
  "schema": "regex_plan_v1",
  "intent": {
    "schema": "regex_intent_v1",
    "prompt": "",
    "assumptions": [],
    "hints": {}
  },
  "intent_hash": "sha256:",
  "match": {
    "pattern": "",
    "flags": {
      "ignore_case": false,
      "multiline": false,
      "dotall": false
    },
    "max_matches": 1000,
    "timeout": 30,
    "format": "auto"
  },
  "notes": {
    "pattern_explanation": "",
    "edge_cases": ""
  }
}
